{
  "hit_chance": {
    "atk_stat_factor": 0.005,
    "def_stat_factor": 0.005,
    "base": 0.7,
    "skill_scale": 200.0,
    "atkdef_scale": 200.0,
    "min": 0.02,
    "max": 0.98
  },
  "parry": {
    "shield_base": 0.10,
    "dex_factor": 0.0025,
    "skill_scale": 200.0,
    "cap": 0.60,
    "damage_reduction": 0.5
  },
  "damage": {
    "str_per_bonus": 10,
    "tactics_mult": 0.003,
    "anatomy_mult": 0.002,
    "min_damage": 1
  },
  "movement": {
    "base_tiles": 3,
    "dex_tile_step": 40,
    "max_tiles": 6
  },
  "recovery": {
    "max_recovery": 3,
    "weapon_base_delay": {
      "dagger": 0,
      "short_sword": 0,
      "long_sword": 1,
      "halberd": 2,
      "maul": 1,
      "heavy_crossbow": 3,
      "crossbow": 2,
      "short_bow": 1
    },
    "dex_reduction_step": 40
  },
  "ranged": {
    "bow_base_reload": 1,
    "xbow_base_reload": 2,
    "heavy_xbow_base_reload": 3,
    "dex_reload_step": 50
  },
  "initiative": {
    "dice": "d100",
    "dex_weight": 0.8,
    "stam_weight": 0.2,
    "weapon_ready_bonus": {
      "light": 10,
      "medium": 0,
      "heavy": -10
    }
  },
  "dodge": {
    "stamina_cost": 15,
    "movement_tiles": 1,
    "evade_bonus": 0.3,
    "duration_turns": 1,
    "blocks_recovery": false,
    "requires_clear_path": true
  },
  "crit": {
    "enabled": false,
    "chance": 0.02,
    "mult": 1.25
  }
}
